{"canonical_frame_ref":"/multimodal_annotation_package/canonical_frame","core_views":[{"camera_position_direction":[0.0,-1.0,0.0],"canvas_size":[1024,1024],"geometry_artifact_hash":"f8063a46d2b95d74e317e2961acc725d36c63085b30d1e412aafa28d197886ba","look_direction":[-0.0,1.0,-0.0],"near_far":[-22.095,22.095],"orthographic_scale":32.60470588,"projection":"orthographic","quality_checks":{"cropped":false,"nonblank":true,"occupied_pixel_fraction":0.469368,"raster_backend":"VTK_z_buffer_cell_scalar_masks"},"render_modes":{"depth":{"availability":"unsupported"},"exact_visible_hidden_lines_png":{"bytes":63140,"height_px":1024,"path":"data/production/cadengbench_p_1800_v2_two_source_r25/dataset/items/p_benchcad_000333/visuals/v2/core/front.hlr_visible_hidden.png","sha256":"806238e5558b3eede3904b8d4edad3c5e1013647691a6cdf0991081353103c5f","width_px":1024},"exact_visible_hidden_lines_svg":{"bytes":41421,"path":"data/production/cadengbench_p_1800_v2_two_source_r25/dataset/items/p_benchcad_000333/visuals/v2/core/front.hlr_visible_hidden.svg","sha256":"5aef8826b319bf802910a1396afcee41d28524d6264002e67a9501739a763efb"},"exact_visible_lines_png":{"bytes":42208,"height_px":1024,"path":"data/production/cadengbench_p_1800_v2_two_source_r25/dataset/items/p_benchcad_000333/visuals/v2/core/front.hlr_visible.png","sha256":"0801857107ddcb28bdbad5e3fd73233aee325136dd484457d10a1b89324f7814","width_px":1024},"exact_visible_lines_svg":{"bytes":8693,"path":"data/production/cadengbench_p_1800_v2_two_source_r25/dataset/items/p_benchcad_000333/visuals/v2/core/front.hlr_visible.svg","sha256":"9865cfeeac1b50e3fd39c634c06866287b5bae0a978a6fb78290804f976adbde"},"face_id_mask":{"bytes":9469,"height_px":1024,"path":"data/production/cadengbench_p_1800_v2_two_source_r25/dataset/items/p_benchcad_000333/visuals/v2/core/front.face_ids.png","sha256":"6a9bf2f3f2fa2e41375bfa1d8638810435ca4485593dd73a4afe8e8f39299b72","width_px":1024},"feature_id_mask":{"bytes":3129,"height_px":1024,"path":"data/production/cadengbench_p_1800_v2_two_source_r25/dataset/items/p_benchcad_000333/visuals/v2/core/front.feature_ids.png","sha256":"282184b4e14a1d87ebfb2d8c371c0d029e2786a27924357d8f7a905a285438a0","width_px":1024},"shaded":{"bytes":10652,"height_px":1024,"path":"data/production/cadengbench_p_1800_v2_two_source_r25/dataset/items/p_benchcad_000333/visuals/v2/core/front.shaded.png","sha256":"631bbfa58ec23ee3ccf79979fa5dae5e8ff7c5d4017cf5b9f1f84ae585ed2693","width_px":1024},"silhouette_mask":{"bytes":7572,"height_px":1024,"path":"data/production/cadengbench_p_1800_v2_two_source_r25/dataset/items/p_benchcad_000333/visuals/v2/core/front.silhouette.png","sha256":"180940b92427b43ca5e452a21533440f003d329640d6091b2743a8d6aaa3a228","width_px":1024},"surface_normals":{"availability":"unsupported"}},"right_vector":[1.0,0.0,-0.0],"target_occupancy_fraction":0.85,"up_vector":[0.0,0.0,1.0],"view_id":"front","view_role":"core","visibility_metadata":{"faces":{"face_10a23b17930d":[69,87,171],"face_4784ee8bff4a":[128,163,202],"face_48ef22558bb7":[221,156,70],"face_5162c136fe84":[211,148,92],"face_580012749091":[151,176,76],"face_5b4fa6b7f0f0":[136,45,217],"face_66487e38a450":[118,156,39],"face_6f6f12fc3dfd":[60,125,213],"face_8b60e4f613d7":[135,89,203],"face_8cd15f55e31b":[201,139,68],"face_a87b6d106442":[152,202,55],"face_cae943a05c5d":[132,166,42],"face_e1b0385082c4":[205,77,195]},"features":{"hole_cae943a05c5d":[208,53,187]}},"visible_face_ids":["face_6f6f12fc3dfd","face_e1b0385082c4"],"visible_feature_ids":[],"world_to_camera":[[1.0,0.0,-0.0,-0.0],[0.0,0.0,1.0,-0.0],[0.0,-1.0,0.0,-17.565],[0.0,0.0,0.0,1.0]]},{"camera_position_direction":[0.0,1.0,0.0],"canvas_size":[1024,1024],"geometry_artifact_hash":"f8063a46d2b95d74e317e2961acc725d36c63085b30d1e412aafa28d197886ba","look_direction":[-0.0,-1.0,-0.0],"near_far":[-22.095,22.095],"orthographic_scale":32.60470588,"projection":"orthographic","quality_checks":{"cropped":false,"nonblank":true,"occupied_pixel_fraction":0.469368,"raster_backend":"VTK_z_buffer_cell_scalar_masks"},"render_modes":{"depth":{"availability":"unsupported"},"exact_visible_hidden_lines_png":{"bytes":69190,"height_px":1024,"path":"data/production/cadengbench_p_1800_v2_two_source_r25/dataset/items/p_benchcad_000333/visuals/v2/core/rear.hlr_visible_hidden.png","sha256":"13a41e5fad35eaf31dea8e0a994aa9df861da4174f0404c7ae8f048f9ad28588","width_px":1024},"exact_visible_hidden_lines_svg":{"bytes":41419,"path":"data/production/cadengbench_p_1800_v2_two_source_r25/dataset/items/p_benchcad_000333/visuals/v2/core/rear.hlr_visible_hidden.svg","sha256":"8cac3b7f3ebc1e94bb9ba663d0ac1512ae4ea49a702da1770b498b29b55a7550"},"exact_visible_lines_png":{"bytes":59528,"height_px":1024,"path":"data/production/cadengbench_p_1800_v2_two_source_r25/dataset/items/p_benchcad_000333/visuals/v2/core/rear.hlr_visible.png","sha256":"79f49d5093057b6ce78407047c193f685b0cc4e3acec19bad5bbdb4c1606082b","width_px":1024},"exact_visible_lines_svg":{"bytes":17170,"path":"data/production/cadengbench_p_1800_v2_two_source_r25/dataset/items/p_benchcad_000333/visuals/v2/core/rear.hlr_visible.svg","sha256":"870099ab941e7c419996bc450e7557ec3e708ec9d130d058a46edcfc588ea375"},"face_id_mask":{"bytes":11410,"height_px":1024,"path":"data/production/cadengbench_p_1800_v2_two_source_r25/dataset/items/p_benchcad_000333/visuals/v2/core/rear.face_ids.png","sha256":"da7479034263325a724f6bd2006b63805a7bf569e87ee957408db53a98c433f2","width_px":1024},"feature_id_mask":{"bytes":3129,"height_px":1024,"path":"data/production/cadengbench_p_1800_v2_two_source_r25/dataset/items/p_benchcad_000333/visuals/v2/core/rear.feature_ids.png","sha256":"282184b4e14a1d87ebfb2d8c371c0d029e2786a27924357d8f7a905a285438a0","width_px":1024},"shaded":{"bytes":11376,"height_px":1024,"path":"data/production/cadengbench_p_1800_v2_two_source_r25/dataset/items/p_benchcad_000333/visuals/v2/core/rear.shaded.png","sha256":"4e290ed92c74290517f48bc24f17eb8a809c6341e7b670ebbf7443f72796cd17","width_px":1024},"silhouette_mask":{"bytes":7572,"height_px":1024,"path":"data/production/cadengbench_p_1800_v2_two_source_r25/dataset/items/p_benchcad_000333/visuals/v2/core/rear.silhouette.png","sha256":"180940b92427b43ca5e452a21533440f003d329640d6091b2743a8d6aaa3a228","width_px":1024},"surface_normals":{"availability":"unsupported"}},"right_vector":[-1.0,0.0,0.0],"target_occupancy_fraction":0.85,"up_vector":[0.0,-0.0,1.0],"view_id":"rear","view_role":"core","visibility_metadata":{"faces":{"face_10a23b17930d":[69,87,171],"face_4784ee8bff4a":[128,163,202],"face_48ef22558bb7":[221,156,70],"face_5162c136fe84":[211,148,92],"face_580012749091":[151,176,76],"face_5b4fa6b7f0f0":[136,45,217],"face_66487e38a450":[118,156,39],"face_6f6f12fc3dfd":[60,125,213],"face_8b60e4f613d7":[135,89,203],"face_8cd15f55e31b":[201,139,68],"face_a87b6d106442":[152,202,55],"face_cae943a05c5d":[132,166,42],"face_e1b0385082c4":[205,77,195]},"features":{"hole_cae943a05c5d":[208,53,187]}},"visible_face_ids":["face_48ef22558bb7","face_5b4fa6b7f0f0","face_8cd15f55e31b"],"visible_feature_ids":[],"world_to_camera":[[-1.0,0.0,0.0,-0.0],[0.0,-0.0,1.0,-0.0],[0.0,1.0,0.0,17.565],[0.0,0.0,0.0,1.0]]},{"camera_position_direction":[1.0,0.0,0.0],"canvas_size":[1024,1024],"geometry_artifact_hash":"f8063a46d2b95d74e317e2961acc725d36c63085b30d1e412aafa28d197886ba","look_direction":[-1.0,-0.0,-0.0],"near_far":[-11.5475,11.5475],"orthographic_scale":51.98823529,"projection":"orthographic","quality_checks":{"cropped":false,"nonblank":true,"occupied_pixel_fraction":0.381718,"raster_backend":"VTK_z_buffer_cell_scalar_masks"},"render_modes":{"depth":{"availability":"unsupported"},"exact_visible_hidden_lines_png":{"bytes":15517,"height_px":1024,"path":"data/production/cadengbench_p_1800_v2_two_source_r25/dataset/items/p_benchcad_000333/visuals/v2/core/right.hlr_visible_hidden.png","sha256":"e8a693c464f5b2e11eeafb0c9ef7e45fedc8a937f54ddb02c530c87e60c20fff","width_px":1024},"exact_visible_hidden_lines_svg":{"bytes":8230,"path":"data/production/cadengbench_p_1800_v2_two_source_r25/dataset/items/p_benchcad_000333/visuals/v2/core/right.hlr_visible_hidden.svg","sha256":"98af188dee0c1b495620eee4f1fd06bcb8bf8961803b30a4cdc1e39966a3cc20"},"exact_visible_lines_png":{"bytes":7724,"height_px":1024,"path":"data/production/cadengbench_p_1800_v2_two_source_r25/dataset/items/p_benchcad_000333/visuals/v2/core/right.hlr_visible.png","sha256":"ea1e1f564f6a3872420b2891be538d3aa902893293279b4832bc2bc8da5573d1","width_px":1024},"exact_visible_lines_svg":{"bytes":2041,"path":"data/production/cadengbench_p_1800_v2_two_source_r25/dataset/items/p_benchcad_000333/visuals/v2/core/right.hlr_visible.svg","sha256":"9363f131f48c1dea55657871c3bd65962ab78616b52346f83d00f841b973a42a"},"face_id_mask":{"bytes":4275,"height_px":1024,"path":"data/production/cadengbench_p_1800_v2_two_source_r25/dataset/items/p_benchcad_000333/visuals/v2/core/right.face_ids.png","sha256":"90e820be0815b201df2378ffedd0d677557246591b91588fba54728939e31883","width_px":1024},"feature_id_mask":{"bytes":3129,"height_px":1024,"path":"data/production/cadengbench_p_1800_v2_two_source_r25/dataset/items/p_benchcad_000333/visuals/v2/core/right.feature_ids.png","sha256":"282184b4e14a1d87ebfb2d8c371c0d029e2786a27924357d8f7a905a285438a0","width_px":1024},"shaded":{"bytes":6307,"height_px":1024,"path":"data/production/cadengbench_p_1800_v2_two_source_r25/dataset/items/p_benchcad_000333/visuals/v2/core/right.shaded.png","sha256":"46eca34fb0c9aa75d9259b28c6d3fb49ac60415054dcdd2590f22cc4d3dacc75","width_px":1024},"silhouette_mask":{"bytes":4221,"height_px":1024,"path":"data/production/cadengbench_p_1800_v2_two_source_r25/dataset/items/p_benchcad_000333/visuals/v2/core/right.silhouette.png","sha256":"38eb97895a32e8d1428a57d5ce0c0076eae0c38e320b87240d2207412fd3b0f1","width_px":1024},"surface_normals":{"availability":"unsupported"}},"right_vector":[0.0,1.0,0.0],"target_occupancy_fraction":0.85,"up_vector":[0.0,0.0,1.0],"view_id":"right","view_role":"core","visibility_metadata":{"faces":{"face_10a23b17930d"